bIDnum,job_title,job_description,qualifications,starting_pay
78,Praesent luctus.,"gravida. Praesent eu nulla at sem molestie sodales. Mauris blandit enim consequat purus. Maecenas libero est,",ac orci. Ut semper pretium neque. Morbi quis urna. Nunc quis arcu vel quam dignissim pharetra. Nam ac nulla.,15589
79,Maecenas,"Vivamus euismod urna. Nullam lobortis quam a felis ullamcorper viverra. Maecenas iaculis aliquet diam. Sed diam lorem,","amet, faucibus ut, nulla. Cras eu tellus eu augue porttitor interdum.",14750
80,dolor sit,"nunc ac mattis ornare, lectus ante dictum mi, ac mattis velit justo nec ante. Maecenas mi felis, adipiscing fringilla, porttitor vulputate, posuere vulputate, lacus. Cras interdum. Nunc sollicitudin commodo ipsum. Suspendisse non leo. Vivamus nibh dolor, nonummy ac, feugiat",et ipsum cursus vestibulum. Mauris magna. Duis dignissim tempor arcu.,43103
81,Nullam scelerisque neque,"nunc est, mollis non, cursus non, egestas a, dui. Cras pellentesque. Sed dictum. Proin eget odio. Aliquam vulputate ullamcorper magna. Sed eu eros. Nam consequat dolor vitae dolor.","dolor. Fusce mi lorem, vehicula et, rutrum eu, ultrices sit amet, risus. Donec nibh enim, gravida sit amet, dapibus",42747
82,"ac facilisis facilisis,","Duis a mi fringilla mi lacinia mattis. Integer eu lacus. Quisque imperdiet, erat nonummy ultricies ornare, elit elit fermentum risus, at fringilla purus mauris a nunc.","risus. Quisque libero lacus, varius et, euismod et, commodo at, libero. Morbi",21494
83,erat vitae risus.,mus. Donec dignissim magna a tortor. Nunc commodo auctor velit. Aliquam nisl. Nulla eu neque pellentesque massa lobortis ultrices. Vivamus,"Fusce diam nunc, ullamcorper eu, euismod ac, fermentum vel, mauris. Integer sem elit, pharetra ut, pharetra sed, hendrerit a, arcu.",18733
84,Maecenas libero,"ultrices sit amet, risus. Donec nibh enim, gravida sit amet, dapibus id, blandit at, nisi. Cum sociis natoque penatibus et magnis dis parturient montes, nascetur",Aenean eget metus. In nec orci. Donec nibh. Quisque nonummy ipsum non arcu. Vivamus,15446
85,nec,non dui nec urna suscipit nonummy. Fusce fermentum fermentum arcu. Vestibulum ante ipsum primis in faucibus orci luctus et ultrices posuere cubilia Curae;,orci. Donec nibh. Quisque nonummy ipsum non arcu. Vivamus sit amet risus.,36212
86,eleifend.,"magna. Phasellus dolor elit, pellentesque a, facilisis non, bibendum sed, est. Nunc laoreet lectus quis massa. Mauris vestibulum, neque sed dictum eleifend, nunc risus varius orci, in consequat enim diam vel arcu. Curabitur ut odio vel est tempor bibendum. Donec felis orci, adipiscing","ipsum dolor sit amet, consectetuer adipiscing elit. Aliquam auctor, velit eget laoreet posuere, enim nisl elementum purus, accumsan interdum libero",48348
87,"Cras lorem lorem, luctus","Etiam gravida molestie arcu. Sed eu nibh vulputate mauris sagittis placerat. Cras dictum ultricies ligula. Nullam enim. Sed nulla ante, iaculis nec, eleifend non, dapibus rutrum, justo. Praesent luctus. Curabitur egestas nunc sed","scelerisque scelerisque dui. Suspendisse ac metus vitae velit egestas lacinia. Sed congue, elit sed consequat auctor, nunc",54674
88,"libero lacus,","Phasellus in felis. Nulla tempor augue ac ipsum. Phasellus vitae mauris sit amet lorem semper auctor. Mauris vel turpis. Aliquam adipiscing lobortis risus. In mi pede, nonummy ut, molestie in,","dis parturient montes, nascetur ridiculus mus. Donec dignissim magna a tortor. Nunc commodo auctor velit.",37961
89,vestibulum. Mauris magna. Duis,magna a neque. Nullam ut nisi a odio semper cursus. Integer mollis. Integer tincidunt aliquam arcu.,"metus. In lorem. Donec elementum, lorem ut aliquam iaculis, lacus pede sagittis",71550
90,lacus.,"ante lectus convallis est, vitae sodales nisi magna sed dui. Fusce aliquam, enim nec tempus scelerisque, lorem",non enim. Mauris quis turpis vitae purus gravida sagittis. Duis gravida. Praesent,32760
91,ipsum primis,"augue id ante dictum cursus. Nunc mauris elit, dictum eu, eleifend nec, malesuada ut, sem. Nulla interdum. Curabitur dictum. Phasellus in felis. Nulla tempor augue ac ipsum. Phasellus vitae mauris sit amet lorem semper auctor. Mauris vel turpis. Aliquam","feugiat. Lorem ipsum dolor sit amet, consectetuer adipiscing elit. Aliquam auctor, velit eget laoreet posuere, enim",40114
92,"Phasellus libero mauris, aliquam","odio tristique pharetra. Quisque ac libero nec ligula consectetuer rhoncus. Nullam velit dui, semper et, lacinia vitae, sodales at, velit. Pellentesque ultricies dignissim lacus. Aliquam rutrum lorem ac risus. Morbi metus. Vivamus euismod urna. Nullam lobortis quam a felis ullamcorper viverra.","bibendum sed, est. Nunc laoreet lectus quis massa. Mauris vestibulum,",42521
93,aptent taciti sociosqu ad,"eu turpis. Nulla aliquet. Proin velit. Sed malesuada augue ut lacus. Nulla tincidunt, neque vitae semper egestas, urna justo faucibus lectus, a sollicitudin orci sem eget massa.","rutrum, justo. Praesent luctus. Curabitur egestas nunc sed libero. Proin sed turpis nec mauris",72554
94,adipiscing,"arcu. Sed et libero. Proin mi. Aliquam gravida mauris ut mi. Duis risus odio, auctor vitae, aliquet nec, imperdiet nec, leo. Morbi neque tellus, imperdiet non, vestibulum nec, euismod in, dolor. Fusce feugiat. Lorem ipsum dolor sit",neque. Morbi quis urna. Nunc quis arcu vel quam dignissim pharetra. Nam ac nulla. In tincidunt,73345
95,"eu,","nulla ante, iaculis nec, eleifend non, dapibus rutrum, justo. Praesent luctus. Curabitur egestas nunc sed libero. Proin sed","feugiat non, lobortis quis, pede. Suspendisse dui. Fusce diam nunc, ullamcorper eu, euismod ac, fermentum vel, mauris. Integer sem",31563
96,sapien molestie orci,"blandit at, nisi. Cum sociis natoque penatibus et magnis dis parturient montes, nascetur ridiculus mus. Proin vel nisl. Quisque fringilla euismod enim. Etiam gravida molestie arcu. Sed","Donec egestas. Aliquam nec enim. Nunc ut erat. Sed nunc est, mollis non,",64670
97,Aenean egestas,justo. Praesent luctus. Curabitur egestas nunc sed libero. Proin sed turpis nec mauris blandit mattis. Cras eget nisi dictum augue malesuada malesuada. Integer id magna et ipsum cursus vestibulum. Mauris magna. Duis dignissim tempor arcu. Vestibulum ut eros non enim commodo hendrerit.,nec metus facilisis lorem tristique aliquet. Phasellus fermentum convallis ligula. Donec luctus aliquet odio. Etiam,38046
98,"malesuada vel, venenatis vel,","augue porttitor interdum. Sed auctor odio a purus. Duis elementum, dui quis accumsan convallis, ante lectus convallis est, vitae sodales nisi magna sed dui. Fusce aliquam, enim nec tempus","massa lobortis ultrices. Vivamus rhoncus. Donec est. Nunc ullamcorper, velit in aliquet lobortis, nisi nibh lacinia",71443
99,Donec luctus aliquet odio.,"cursus in, hendrerit consectetuer, cursus et, magna. Praesent interdum ligula eu enim. Etiam imperdiet dictum magna. Ut tincidunt orci quis lectus. Nullam suscipit, est ac facilisis facilisis, magna tellus faucibus leo, in lobortis tellus justo sit amet nulla.","amet lorem semper auctor. Mauris vel turpis. Aliquam adipiscing lobortis risus. In mi pede, nonummy ut, molestie",45677
100,tempor diam,Morbi quis urna. Nunc quis arcu vel quam dignissim pharetra. Nam ac nulla. In tincidunt congue turpis.,eu tempor erat neque non quam. Pellentesque habitant morbi tristique senectus et netus et malesuada fames ac turpis egestas.,22954